<?xml version="1.0" encoding="ISO-8859-1"?>

<!DOCTYPE Alignment SYSTEM "alignment.dtd">

<Alignment>

<TimeStamp Value="&#x53;&#x61;&#x74;&#x75;&#x72;&#x64;&#x61;&#x79;&#x2c;&#x20;&#x41;&#x75;&#x67;&#x75;&#x73;&#x74;&#x20;&#x31;&#x33;&#x2c;&#x20;&#x32;&#x30;&#x32;&#x32;&#x20;&#x74;&#x69;&#x6d;&#x65;&#x20;&#x31;&#x39;&#x68;&#x20;&#x30;&#x34;&#x6d;&#x20;&#x30;&#x32;&#x73;"/>

<WinPitch Program="Corpus"  Version="Version U2.00"/>


<Layer1 Name="&#x41;&#x4e;&#x54;" ID="&#x4c;&#x61;&#x79;&#x65;&#x72;&#x31;" Short="&#x41;&#x4e;&#x54;" TagName="" TagSet="" Color="RGB(255,255,255)"/>

<UNIT speaker="&#x41;&#x4e;&#x54;" startTime="2.573 s" endTime="7.719 s" Channel="M" Tag="" Rank="1">&#x45;&#x72;&#x61;&#x20;&#x61;&#x20;&#x64;&#x6f;&#x6e;&#x61;&#x20;&#x5b;&#x2f;&#x32;&#x5d;&#x3d;&#x53;&#x43;&#x41;&#x3d;&#x20;&#x65;&#x72;&#x61;&#x20;&#x5b;&#x2f;&#x31;&#x5d;&#x3d;&#x53;&#x43;&#x41;&#x3d;&#x20;&#x61;&#x20;&#x64;&#x6f;&#x6e;&#x61;&#x20;&#x63;&#x61;&#x73;&#x61;&#x64;&#x61;&#x20;&#x2f;&#x3d;&#x43;&#x4f;&#x42;&#x3d;&#x20;&#x65;&#x6c;&#x61;&#x20;&#x74;&#x69;&#x6e;&#x68;&#x61;&#x20;&#x74;&#x72;&#xea;&#x73;&#x20;&#x66;&#x69;&#x6c;&#x68;&#x61;&#x20;&#x2f;&#x2f;&#x3d;&#x43;&#x4f;&#x4d;&#x3d;</UNIT>
<UNIT speaker="&#x41;&#x4e;&#x54;" startTime="11.448 s" endTime="18.794 s" Channel="M" Tag="" Rank="2">&#x61;&#xed;&#x20;&#x2f;&#x3d;&#x41;&#x55;&#x58;&#x3d;&#x20;&#x71;&#x75;&#x61;&#x6e;&#x64;&#x6f;&#x20;&#x70;&#x61;&#x73;&#x73;&#x6f;&#x75;&#x20;&#x2f;&#x3d;&#x53;&#x43;&#x41;&#x3d;&#x20;&#x75;&#x6e;&#x73;&#x20;&#x74;&#x65;&#x6d;&#x70;&#x6f;&#x20;&#x2f;&#x3d;&#x43;&#x4f;&#x42;&#x3d;&#x20;&#x65;&#x6c;&#x61;&#x20;&#x67;&#x61;&#x6e;&#x68;&#x6f;&#x75;&#x20;&#x5b;&#x2f;&#x31;&#x5d;&#x3d;&#x53;&#x43;&#x41;&#x3d;&#x20;&#x67;&#x61;&#x6e;&#x68;&#x6f;&#x75;&#x20;&#x75;&#x6d;&#x20;&#x6d;&#x65;&#x6e;&#x69;&#x6e;&#x6f;&#x20;&#x2f;&#x2f;&#x3d;&#x43;&#x4f;&#x4d;&#x3d;</UNIT>
<UNIT speaker="&#x41;&#x4e;&#x54;" startTime="21.375 s" endTime="40.789 s" Channel="M" Tag="" Rank="3">&#x67;&#x61;&#x6e;&#x68;&#x6f;&#x75;&#x20;&#x75;&#x6d;&#x20;&#x6d;&#x65;&#x6e;&#x69;&#x6e;&#x6f;&#x20;&#x2f;&#x3d;&#x43;&#x4f;&#x42;&#x3d;&#x20;&#x61;&#xed;&#x20;&#x2f;&#x3d;&#x41;&#x55;&#x58;&#x3d;&#x20;&#x65;&#x20;&#x66;&#x61;&#x6c;&#x6f;&#x75;&#x20;&#x63;&#x61;&#x20;&#x5b;&#x2f;&#x31;&#x5d;&#x3d;&#x53;&#x43;&#x41;&#x3d;&#x20;&#x63;&#x6f;&#x6d;&#x20;&#x61;&#x20;&#x4d;&#x61;&#x72;&#x69;&#x61;&#x20;&#x4d;&#x61;&#x69;&#x73;&#x20;&#x76;&#x65;&#x6c;&#x68;&#x61;&#x20;&#x2f;&#x3d;&#x43;&#x4f;&#x42;&#x3d;&#x20;&#x20;&#x76;&#x6f;&#x63;&#xea;&#x20;&#x76;&#x61;&#x69;&#x20;&#x6c;&#xe1;&#x20;&#x2f;&#x3d;&#x53;&#x43;&#x41;&#x5f;&#x72;&#x3d;&#x20;&#x6e;&#x61;&#x20;&#x68;&#x6f;&#x72;&#x74;&#x61;&#x20;&#x2f;&#x3d;&#x43;&#x4f;&#x42;&#x5f;&#x72;&#x3d;&#x20;&#x61;&#x70;&#x61;&#x6e;&#x68;&#x61;&#x20;&#x2f;&#x3d;&#x53;&#x43;&#x41;&#x5f;&#x72;&#x3d;&#x20;&#x75;&#x6d;&#x20;&#x62;&#x6f;&#x74;&#xe3;&#x6f;&#x20;&#x64;&#x65;&#x20;&#x72;&#x6f;&#x73;&#x61;&#x20;&#x2f;&#x3d;&#x43;&#x4f;&#x42;&#x5f;&#x72;&#x3d;&#x20;&#x65;&#x20;&#x74;&#x72;&#x61;&#x7a;&#x20;&#x2f;&#x3d;&#x53;&#x43;&#x41;&#x3d;&#x20;&#x20;&#x74;&#x72;&#xea;&#x73;&#x20;&#x6d;&#x6f;&#x6c;&#x68;&#x6f;&#x20;&#x5b;&#x2f;&#x31;&#x5d;&#x3d;&#x45;&#x4d;&#x50;&#x5f;&#x72;&#x3d;&#x20;&#x74;&#x72;&#xea;&#x73;&#x20;&#x66;&#x6f;&#x6c;&#x68;&#x61;&#x20;&#x64;&#x65;&#x20;&#x63;&#x6f;&#x75;&#x76;&#x65;&#x20;&#x2f;&#x2f;&#x3d;&#x43;&#x4f;&#x4d;&#x5f;&#x72;&#x3d;</UNIT>
<UNIT speaker="&#x41;&#x4e;&#x54;" startTime="41.002 s" endTime="46.202 s" Channel="M" Tag="" Rank="4">&#x70;&#x61;&#x72;&#x61;&#x20;&#x70;&#x6f;&#x64;&#x65;&#x72;&#x20;&#x66;&#x61;&#x7a;&#x65;&#x72;&#x20;&#x5b;&#x2f;&#x32;&#x5d;&#x3d;&#x53;&#x43;&#x41;&#x5f;&#x72;&#x3d;&#x20;&#x6e;&#xf3;&#x73;&#x20;&#x66;&#x61;&#x7a;&#x65;&#x72;&#x20;&#x6e;&#x61;&#x20;&#x68;&#x6f;&#x72;&#x61;&#x20;&#x64;&#x6f;&#x20;&#x62;&#x61;&#x74;&#x69;&#x7a;&#x61;&#x64;&#x6f;&#x20;&#x64;&#x6f;&#x20;&#x6d;&#x65;&#x6e;&#x69;&#x6e;&#x6f;&#x20;&#x2f;&#x3d;&#x43;&#x4f;&#x42;&#x5f;&#x72;&#x3d;&#x20;&#x69;&#x6e;&#x74;&#x65;&#x69;&#x72;&#x61;&#x72;&#x20;&#x63;&#x6f;&#x6d;&#x20;&#x61;&#x73;&#x20;&#x6f;&#x75;&#x74;&#x72;&#x61;&#x20;&#x63;&#x6f;&#x6d;&#x69;&#x64;&#x61;&#x20;&#x2f;&#x2f;&#x3d;&#x43;&#x4f;&#x4d;&#x5f;&#x72;&#x3d;</UNIT>
<UNIT speaker="&#x41;&#x4e;&#x54;" startTime="48.882 s" endTime="50.397 s" Channel="M" Tag="" Rank="5">&#x61;&#xed;&#x20;&#x2f;&#x3d;&#x41;&#x55;&#x58;&#x3d;&#x20;&#x65;&#x6c;&#x61;&#x20;&#x62;&#x61;&#x74;&#x65;&#x75;&#x20;&#x70;&#x61;&#x72;&#x61;&#x20;&#x6c;&#xe1;&#x20;&#x2f;&#x2f;&#x3d;&#x43;&#x4f;&#x4d;&#x3d;</UNIT>
<UNIT speaker="&#x41;&#x4e;&#x54;" startTime="51.049 s" endTime="67.055 s" Channel="M" Tag="" Rank="6">&#x61;&#xed;&#x20;&#x63;&#x68;&#x65;&#x67;&#x6f;&#x75;&#x20;&#x6c;&#xe1;&#x20;&#x2f;&#x3d;&#x43;&#x4f;&#x42;&#x3d;&#x20;&#x61;&#x70;&#x61;&#x6e;&#x68;&#x6f;&#x75;&#x20;&#x2f;&#x20;&#x6f;&#x20;&#x62;&#x6f;&#x74;&#xe3;&#x6f;&#x20;&#x64;&#x65;&#x20;&#x72;&#x6f;&#x73;&#x61;&#x20;&#x2f;&#x20;&#x71;&#x75;&#x61;&#x6e;&#x64;&#x6f;&#x20;&#x65;&#x6c;&#x61;&#x20;&#x66;&#x6f;&#x69;&#x20;&#x70;&#x61;&#x72;&#x61;&#x20;&#x61;&#x70;&#x61;&#x6e;&#x68;&#x61;&#x72;&#x20;&#x6f;&#x20;&#x6d;&#x6f;&#x6c;&#x68;&#x6f;&#x20;&#x64;&#x65;&#x20;&#x63;&#x6f;&#x75;&#x76;&#x65;&#x20;&#x2f;&#x20;&#x6f;&#x20;&#x52;&#x65;&#x69;&#x20;&#x64;&#x6f;&#x20;&#x2f;&#x20;&#x64;&#x6f;&#x73;&#x20;&#x42;&#x6f;&#x69;&#x20;&#x76;&#x65;&#x69;&#x6f;&#x20;&#x2f;&#x20;&#x70;&#x61;&#x73;&#x73;&#x6f;&#x75;&#x20;&#x61;&#x20;&#x6d;&#xe3;&#x6f;&#x20;&#x6e;&#x65;&#x6c;&#x61;&#x20;&#x2f;&#x2f;</UNIT>
<UNIT speaker="&#x41;&#x4e;&#x54;" startTime="67.055 s" endTime="67.492 s" Channel="M" Tag="" Rank="7">&#x61;&#xed;&#x20;&#x63;&#x68;&#x65;&#x67;&#x6f;&#x75;&#x20;&#x6c;&#xe1;&#x20;&#x2f;&#x3d;&#x43;&#x4f;&#x42;&#x3d;&#x20;&#x61;&#x70;&#x61;&#x6e;&#x68;&#x6f;&#x75;&#x20;&#x2f;&#x3d;&#x53;&#x43;&#x41;&#x3d;&#x20;&#x6f;&#x20;&#x62;&#x6f;&#x74;&#xe3;&#x6f;&#x20;&#x64;&#x65;&#x20;&#x72;&#x6f;&#x73;&#x61;&#x20;&#x2f;&#x3d;&#x43;&#x4f;&#x42;&#x3d;&#x20;&#x71;&#x75;&#x61;&#x6e;&#x64;&#x6f;&#x20;&#x65;&#x6c;&#x61;&#x20;&#x66;&#x6f;&#x69;&#x20;&#x70;&#x61;&#x72;&#x61;&#x20;&#x61;&#x70;&#x61;&#x6e;&#x68;&#x61;&#x72;&#x20;&#x6f;&#x20;&#x6d;&#x6f;&#x6c;&#x68;&#x6f;&#x20;&#x64;&#x65;&#x20;&#x63;&#x6f;&#x75;&#x76;&#x65;&#x20;&#x2f;&#x3d;&#x54;&#x4f;&#x50;&#x3d;&#x20;&#x6f;&#x20;&#x52;&#x65;&#x69;&#x20;&#x64;&#x6f;&#x20;&#x2f;&#x3d;&#x53;&#x43;&#x41;&#x3d;&#x20;&#x64;&#x6f;&#x73;&#x20;&#x42;&#x6f;&#x69;&#x20;&#x76;&#x65;&#x69;&#x6f;&#x20;&#x2f;&#x3d;&#x43;&#x4f;&#x42;&#x3d;&#x20;&#x70;&#x61;&#x73;&#x73;&#x6f;&#x75;&#x20;&#x61;&#x20;&#x6d;&#xe3;&#x6f;&#x20;&#x6e;&#x65;&#x6c;&#x61;&#x20;&#x2f;&#x2f;&#x3d;&#x43;&#x4f;&#x4d;&#x3d;</UNIT>
<UNIT speaker="&#x41;&#x4e;&#x54;" startTime="67.968 s" endTime="68.862 s" Channel="M" Tag="" Rank="8">&#x66;&#x6f;&#x69;&#x20;&#x65;&#x6d;&#x62;&#x6f;&#x72;&#x61;&#x20;&#x2f;&#x2f;&#x3d;&#x43;&#x4f;&#x4d;&#x3d;</UNIT>
<UNIT speaker="&#x41;&#x4e;&#x54;" startTime="73.556 s" endTime="77.090 s" Channel="M" Tag="" Rank="9">&#x61;&#xed;&#x20;&#x2f;&#x3d;&#x41;&#x55;&#x58;&#x3d;&#x20;&#x66;&#x69;&#x63;&#x6f;&#x75;&#x20;&#x61;&#x20;&#x5b;&#x2f;&#x31;&#x5d;&#x3d;&#x53;&#x43;&#x41;&#x3d;&#x20;&#x61;&#x20;&#x4d;&#x61;&#x72;&#x69;&#x61;&#x20;&#x64;&#x6f;&#x20;&#x4d;&#x65;&#x69;&#x6f;&#x20;&#x2f;&#x2f;&#x3d;&#x43;&#x4f;&#x4d;&#x3d;</UNIT>
<UNIT speaker="&#x41;&#x4e;&#x54;" startTime="77.294 s" endTime="86.788 s" Channel="M" Tag="" Rank="10">&#xf4;&#x20;&#x6d;&#x69;&#x6e;&#x68;&#x61;&#x20;&#x69;&#x72;&#x6d;&#xe3;&#x20;&#x2f;&#x20;&#x6d;&#x61;&#x20;&#x5b;&#x2f;&#x31;&#x5d;&#x20;&#x26;&#x68;&#x65;&#x20;&#x2f;&#x20;&#x76;&#x61;&#x69;&#x20;&#x6c;&#xe1;&#x20;&#x6e;&#x61;&#x20;&#x5b;&#x2f;&#x31;&#x5d;&#x20;&#x6e;&#x61;&#x20;&#x68;&#x6f;&#x72;&#x74;&#x61;&#x20;&#x61;&#x70;&#x61;&#x6e;&#x68;&#x61;&#x20;&#x6f;&#x20;&#x6d;&#x6f;&#x6c;&#x68;&#x6f;&#x20;&#x64;&#x65;&#x20;&#x63;&#x6f;&#x75;&#x76;&#x65;&#x20;&#x65;&#x20;&#x6f;&#x20;&#x62;&#x6f;&#x74;&#xe3;&#x6f;&#x20;&#x64;&#x65;&#x20;&#x72;&#x6f;&#x73;&#x61;&#x20;&#x2f;&#x3d;&#x43;&#x4f;&#x42;&#x5f;&#x72;&#x3d;&#x20;&#x71;&#x75;&#x65;&#x20;&#x73;&#x75;&#x61;&#x20;&#x69;&#x72;&#x6d;&#xe3;&#x20;&#x74;&#x69;&#x76;&#x65;&#x72;&#x20;&#x6c;&#xe1;&#x20;&#x63;&#xe9;&#x20;&#x74;&#x72;&#x61;&#x7a;&#x20;&#x2b;&#x3d;&#x45;&#x4d;&#x50;&#x5f;&#x72;&#x3d;</UNIT>
<UNIT speaker="&#x41;&#x4e;&#x54;" startTime="86.788 s" endTime="87.068 s" Channel="M" Tag="" Rank="11">&#xf4;&#x20;&#x6d;&#x69;&#x6e;&#x68;&#x61;&#x20;&#x69;&#x72;&#x6d;&#xe3;&#x20;&#x2f;&#x20;&#x6d;&#x61;&#x20;&#x5b;&#x2f;&#x31;&#x5d;&#x20;&#x26;&#x68;&#x65;&#x20;&#x2f;&#x20;&#x76;&#x61;&#x69;&#x20;&#x6c;&#xe1;&#x20;&#x6e;&#x61;&#x20;&#x5b;&#x2f;&#x31;&#x5d;&#x20;&#x6e;&#x61;&#x20;&#x68;&#x6f;&#x72;&#x74;&#x61;&#x20;&#x61;&#x70;&#x61;&#x6e;&#x68;&#x61;&#x20;&#x6f;&#x20;&#x6d;&#x6f;&#x6c;&#x68;&#x6f;&#x20;&#x64;&#x65;&#x20;&#x63;&#x6f;&#x75;&#x76;&#x65;&#x20;&#x65;&#x20;&#x6f;&#x20;&#x62;&#x6f;&#x74;&#xe3;&#x6f;&#x20;&#x64;&#x65;&#x20;&#x72;&#x6f;&#x73;&#x61;&#x20;&#x2f;&#x3d;&#x43;&#x4f;&#x42;&#x5f;&#x72;&#x3d;&#x20;&#x71;&#x75;&#x65;&#x20;&#x73;&#x75;&#x61;&#x20;&#x69;&#x72;&#x6d;&#xe3;&#x20;&#x74;&#x69;&#x76;&#x65;&#x72;&#x20;&#x6c;&#xe1;&#x20;&#x63;&#xe9;&#x20;&#x74;&#x72;&#x61;&#x7a;&#x20;&#x2b;&#x3d;&#x45;&#x4d;&#x50;&#x5f;&#x72;&#x3d;</UNIT>